{
  "schema_version": "1.0.0",
  "catalog_version": "2.0.0",
  "syllabi_catalog_path": "data/syllabi-catalog.json",
  "oppositions": [
    {
      "id": "OPP-GSI",
      "short_code": "GSI",
      "official_name": "Gestión de Sistemas e Informática de la Administración del Estado — GSI A2, ingreso libre",
      "status": "active",
      "runtime_status": "legacy-operational",
      "runtime_available": true,
      "has_legacy_operational_syllabus": true,
      "syllabus_ids": [
        "SYL-GSI-2025"
      ],
      "program_location": {
        "status": "cataloged",
        "source_id": "SRC-BOE-GSI-2025",
        "document_id": "DOC-BOE-GSI-2025",
        "document_path": "documents/markdown/gsi/BOE-A-2025-26262-Anexo-IX.md",
        "locator": "Anexo IX"
      }
    }
  ]
}
